Started by user Dasari Rakesh (CVC8DZC)
Building remotely on UFT_EntAutomation_N1 (uft-ent-n1) in workspace C:\Program Files\Jenkins\UFT_EntAutomation_N1\workspace\jenkinsmaster-5\ENT\EntAutomation\Performance_Jobs\Test_Controller
No emails were triggered.
[Test_Controller] $ "C:\Program Files\Jenkins\UFT_EntAutomation_N1\workspace\jenkinsmaster-5\ENT\EntAutomation\Performance_Jobs\Test_Controller\HpToolsLauncher.exe" -paramfile props28062019112216959.txt
"Started..."
Run build tests
Launcher timeout is 10675199::02:48:05
Controller Polling Interval: 30 seconds
PerScenarioTimeout: 00::00:10:00 minutes
FileSystemTestRunner timeout is 10675199.02:48:05.4775807
Mc connection info is - Mc HostAddress: , McPort: 8080, Username: , TenantId: , UseSSL: 0, UseProxy: 0, ProxyType: 0, ProxyAddress: , ProxyPort: 0, ProxyAuth: 0, ProxyUser: 
1 tests found:
D:\LRC_Test App\SDC_Scripts\SDC_Scenario2.lrs
============================================================================
28/06/2019 11:22:30 Running: D:\LRC_Test App\SDC_Scripts\SDC_Scenario2.lrs
D:\LRC_Test App\SDC_Scripts\SDC_Scenario2.lrs
Cleaning up the environment...
wlrun killed
Preparing scenario D:\LRC_Test App\SDC_Scripts\SDC_Scenario2.lrs for execution.
Load Generator localhost connected
setting scenario result folder to C:\Program Files\Jenkins\UFT_EntAutomation_N1\workspace\jenkinsmaster-5\ENT\EntAutomation\Performance_Jobs\Test_Controller\34cccd\LRR
scenario result folder: C:\Program Files\Jenkins\UFT_EntAutomation_N1\workspace\jenkinsmaster-5\ENT\EntAutomation\Performance_Jobs\Test_Controller\34cccd\LRR
Starting scenario...
Scenario run has started

Error: Scenario Execution timeout 00:00:10:00 (d:h:m:s) passed.

Scenario D:\LRC_Test App\SDC_Scripts\SDC_Scenario2.lrs ended after 0:10:0.

============================================================================
Analyzing results...
closing Controller

Controller closed
calling analysis report generator
executing Analysis launcher with arguments : "C:\Program Files\Jenkins\UFT_EntAutomation_N1\workspace\jenkinsmaster-5\ENT\EntAutomation\Performance_Jobs\Test_Controller\34cccd\LRR\LRR.lrr" "C:\Program Files\Jenkins\UFT_EntAutomation_N1\workspace\jenkinsmaster-5\ENT\EntAutomation\Performance_Jobs\Test_Controller\34cccd\LRA\LRA.lra" "C:\Program Files\Jenkins\UFT_EntAutomation_N1\workspace\jenkinsmaster-5\ENT\EntAutomation\Performance_Jobs\Test_Controller\34cccd\HTML\HTML.html" "C:\Program Files (x86)\Micro Focus\LoadRunner\AnalysisTemplates\Test_test_template\Test_test_template.tem"
time for analysis: 00::00:10:00
starting analysis launcher
creating analysis COM object
creating analysis session

analysis session created
creating HTML reports

HTML reports created
loading errors, if any
error count: 18
Error(s) report:
ID: 0 Name: Action.c(16) Error -26624 HTTP Status-Code=407 (authenticationrequired) for "https//test.upssupplierdirectconnect.com/Account/Login"
ID: 1 Name: Action.c(16) Error -27789 Proxy "proxy.njc.ups.com" failed to connect to server "test.upssupplierdirectconnect.com" -- returned status code 407 authenticationrequired
ID: 2 Name: Action.c(16) Error -26377 No match found for the requested parameter "c_RequestToken". Either the specified boundaries were not found in the response or the matched text is longer than current max html parameter size of 999999 bytes. The total length of_2
ID: 3 Name: CreateRentalRequest_Regular.c(11) Error -26624 HTTP Status-Code=407 (authenticationrequired) for "https//test.upssupplierdirectconnect.com/Account/Login"
ID: 4 Name: CreateRentalRequest_Regular.c(11) Error -27789 Proxy "proxy.njc.ups.com" failed to connect to server "test.upssupplierdirectconnect.com" -- returned status code 407 authenticationrequired
ID: 5 Name: CreateRentalRequest_Regular.c(11) Error -26377 No match found for the requested parameter "c_RequetsToken". Either the specified boundaries were not found in the response or the matched text is longer than current max html parameter size of 999999 bytes_5
ID: 6 Name: CreateRentalRequest_UPSAdmin.c(11) Error -26624 HTTP Status-Code=407 (authenticationrequired) for "https//test.upssupplierdirectconnect.com/Account/Login"
ID: 7 Name: CreateRentalRequest_UPSAdmin.c(11) Error -27789 Proxy "proxy.njc.ups.com" failed to connect to server "test.upssupplierdirectconnect.com" -- returned status code 407 authenticationrequired
ID: 8 Name: CreateRentalRequest_UPSAdmin.c(11) Error -26377 No match found for the requested parameter "c_RequetsToken". Either the specified boundaries were not found in the response or the matched text is longer than current max html parameter size of 999999 byte_8
ID: 9 Name: CreateEmergencyRentalRequest.c(13) Error -26624 HTTP Status-Code=407 (authenticationrequired) for "https//test.upssupplierdirectconnect.com/Account/Login"
ID: 10 Name: CreateEmergencyRentalRequest.c(13) Error -27789 Proxy "proxy.njc.ups.com" failed to connect to server "test.upssupplierdirectconnect.com" -- returned status code 407 authenticationrequired
ID: 11 Name: CreateEmergencyRentalRequest.c(13) Error -26377 No match found for the requested parameter "c_RequetsToken". Either the specified boundaries were not found in the response or the matched text is longer than current max html parameter size of 999999 byt_11
ID: 12 Name: Action.c(11) Error -26624 HTTP Status-Code=407 (authenticationrequired) for "https//test.upssupplierdirectconnect.com/Account/Login"
ID: 13 Name: Action.c(11) Error -27789 Proxy "proxy.njc.ups.com" failed to connect to server "test.upssupplierdirectconnect.com" -- returned status code 407 authenticationrequired
ID: 14 Name: Action.c(11) Error -26377 No match found for the requested parameter "c_RequetsToken". Either the specified boundaries were not found in the response or the matched text is longer than current max html parameter size of 999999 bytes. The total length o_14
ID: 15 Name: Action.c(13) Error -26624 HTTP Status-Code=407 (authenticationrequired) for "https//test.upssupplierdirectconnect.com/Account/Login"
ID: 16 Name: Action.c(13) Error -27789 Proxy "proxy.njc.ups.com" failed to connect to server "test.upssupplierdirectconnect.com" -- returned status code 407 authenticationrequired
ID: 17 Name: Action.c(13) Error -26377 No match found for the requested parameter "c_RequetsToken". Either the specified boundaries were not found in the response or the matched text is longer than current max html parameter size of 999999 bytes. The total length o_17
Gathering Run statistics

closing session
SLA report:
calculating SLA

SLA calculation done
WholeRunRules : 6
================================
Transaction Name : 01_CreateEmergencyRequest_Login
Percentile : 90
Full Name : Transaction Response Time (Percentile)
Measurement : PercentileTRT
Goal Value : 200
Actual value : 0
status : NoData
================================
================================
Transaction Name : 01_CreateRentalReuqest_Login
Percentile : 90
Full Name : Transaction Response Time (Percentile)
Measurement : PercentileTRT
Goal Value : 200
Actual value : 0
status : NoData
================================
================================
Transaction Name : 01_DeclineRequest_Login
Percentile : 90
Full Name : Transaction Response Time (Percentile)
Measurement : PercentileTRT
Goal Value : 200
Actual value : 0
status : NoData
================================
================================
Transaction Name : 01_SearchAllRequests_Login
Percentile : 90
Full Name : Transaction Response Time (Percentile)
Measurement : PercentileTRT
Goal Value : 200
Actual value : 0
status : NoData
================================
================================
Transaction Name : 02_SearchAllRequest_Rental_ManageRequest
Percentile : 90
Full Name : Transaction Response Time (Percentile)
Measurement : PercentileTRT
Goal Value : 200
Actual value : 0
status : NoData
================================
================================
Transaction Name : 03_CreateEmergencyRequest_ClickNewEmergencyRequest
Percentile : 90
Full Name : Transaction Response Time (Percentile)
Measurement : PercentileTRT
Goal Value : 200
Actual value : 0
status : NoData
================================
TimeRangeRules : 0
saving RunReport.xml to C:\Program Files\Jenkins\UFT_EntAutomation_N1\workspace\jenkinsmaster-5\ENT\EntAutomation\Performance_Jobs\Test_Controller\34cccd\RunReport.xml
saving SLA.xml to C:\Program Files\Jenkins\UFT_EntAutomation_N1\workspace\jenkinsmaster-5\ENT\EntAutomation\Performance_Jobs\Test_Controller\34cccd\SLA.xml
closing analysis session
time passed: 00::00:00:50
analysis report generator finished
Error: Action.c(16) Error -26624 HTTP Status-Code=407 (authenticationrequired) for "https//test.upssupplierdirectconnect.com/Account/Login"
Error: total number of errors: 1
Error(s) summary: 
0 ignored , 1 errors


Error summary:
1 : Action.c(16) Error -26624 HTTP Status-Code=407 (authenticationrequired) for "https//test.upssupplierdirectconnect.com/Account/Login"

Error: Test FAILED. 1 errors occurred during scenario execution.
Test result: Failed
28/06/2019 11:34:41 Test complete: D:\LRC_Test App\SDC_Scripts\SDC_Scenario2.lrs
-------------------------------------------------------------------------------------------------------
Cleaning up the environment...
================================================
Run status: Job failed, total tests: 1, succeeded: 0, failures: 1, errors: 0
Failed : D:\LRC_Test App\SDC_Scripts\SDC_Scenario2.lrs
================================================
Build step 'Execute Micro Focus tests from file system' changed build result to FAILURE

Email was triggered for: Failure - Any
Sending email for trigger: Failure - Any

Sending email to: rdasari@ups.com gsureka@ups.com

Finished: FAILURE

