03:11:55.210776 IP Marks-Laptop.1947 > BUILDBOX8.57501: . 2833323451:2833324911(1460) ack 133762090 win 256
03:11:55.210776 IP Marks-Laptop.1947 > BUILDBOX8.57501: . 1460:2920(1460) ack 1 win 256
03:11:55.210776 IP Marks-Laptop.1947 > BUILDBOX8.57501: . 2920:4380(1460) ack 1 win 256
03:11:55.210776 IP Marks-Laptop.1947 > BUILDBOX8.57501: . 4380:5840(1460) ack 1 win 256
03:11:55.210777 IP Marks-Laptop.1947 > BUILDBOX8.57501: . 5840:7300(1460) ack 1 win 256
03:11:55.210793 IP BUILDBOX8.57501 > Marks-Laptop.1947: . ack 7300 win 250
03:11:55.210801 IP BUILDBOX8.57501 > Marks-Laptop.1947: . ack 7300 win 256
03:11:55.210907 IP Marks-Laptop.1947 > BUILDBOX8.57501: . 7300:8760(1460) ack 1 win 256
03:11:55.210907 IP Marks-Laptop.1947 > BUILDBOX8.57501: . 8760:10220(1460) ack 1 win 256
03:11:55.210907 IP Marks-Laptop.1947 > BUILDBOX8.57501: . 10220:11680(1460) ack 1 win 256
03:11:55.210907 IP Marks-Laptop.1947 > BUILDBOX8.57501: . 11680:13140(1460) ack 1 win 256
03:11:55.210908 IP Marks-Laptop.1947 > BUILDBOX8.57501: . 13140:14600(1460) ack 1 win 256
03:11:55.210908 IP Marks-Laptop.1947 > BUILDBOX8.57501: . 14600:16060(1460) ack 1 win 256
03:11:55.210911 IP Marks-Laptop.1947 > BUILDBOX8.57501: . 16060:17520(1460) ack 1 win 256
03:11:55.210911 IP Marks-Laptop.1947 > BUILDBOX8.57501: . 17520:18980(1460) ack 1 win 256
03:11:55.210911 IP Marks-Laptop.1947 > BUILDBOX8.57501: . 18980:20440(1460) ack 1 win 256
03:11:55.210911 IP Marks-Laptop.1947 > BUILDBOX8.57501: . 20440:21900(1460) ack 1 win 256
03:11:55.210912 IP Marks-Laptop.1947 > BUILDBOX8.57501: . 21900:23360(1460) ack 1 win 256
03:11:55.210912 IP Marks-Laptop.1947 > BUILDBOX8.57501: . 23360:24820(1460) ack 1 win 256
03:11:55.210912 IP Marks-Laptop.1947 > BUILDBOX8.57501: . 24820:26280(1460) ack 1 win 256
03:11:55.210935 IP BUILDBOX8.57501 > Marks-Laptop.1947: . ack 26280 win 211
03:11:55.210947 IP BUILDBOX8.57501 > Marks-Laptop.1947: . ack 26280 win 256
03:11:55.211026 IP Marks-Laptop.1947 > BUILDBOX8.57501: . 26280:27740(1460) ack 1 win 256
03:11:55.211026 IP Marks-Laptop.1947 > BUILDBOX8.57501: . 27740:29200(1460) ack 1 win 256
03:11:55.211027 IP Marks-Laptop.1947 > BUILDBOX8.57501: FP 29200:30618(1418) ack 1 win 256
03:11:55.211036 IP BUILDBOX8.57501 > Marks-Laptop.1947: . ack 30619 win 256
03:11:55.215210 IP BUILDBOX8.57501 > Marks-Laptop.1947: F 1:1(0) ack 30619 win 256
03:11:55.215299 IP BUILDBOX8.57502 > SAMWIN7TESTPC.1947: S 1703135554:1703135554(0) win 8192 <mss 1460,nop,wscale 8,nop,nop,sackOK>
03:11:55.215745 IP Marks-Laptop.1947 > BUILDBOX8.57501: . ack 2 win 256
03:11:55.215745 IP SAMWIN7TESTPC.1947 > BUILDBOX8.57502: S 821547703:821547703(0) ack 1703135555 win 8192 <mss 1460,nop,wscale 8,nop,nop,sackOK>
03:11:55.215792 IP BUILDBOX8.57502 > SAMWIN7TESTPC.1947: . ack 1 win 256
03:11:55.215810 IP BUILDBOX8.57502 > SAMWIN7TESTPC.1947: P 1:1004(1003) ack 1 win 256
03:11:55.219253 IP SAMWIN7TESTPC.1947 > BUILDBOX8.57502: . 1:1461(1460) ack 1004 win 256
03:11:55.219409 IP SAMWIN7TESTPC.1947 > BUILDBOX8.57502: . 1461:2921(1460) ack 1004 win 256
03:11:55.219414 IP BUILDBOX8.57502 > SAMWIN7TESTPC.1947: . ack 2921 win 256
03:11:55.219861 IP SAMWIN7TESTPC.1947 > BUILDBOX8.57502: . 2921:4381(1460) ack 1004 win 256
03:11:55.220090 IP SAMWIN7TESTPC.1947 > BUILDBOX8.57502: . 4381:5841(1460) ack 1004 win 256
03:11:55.220094 IP BUILDBOX8.57502 > SAMWIN7TESTPC.1947: . ack 5841 win 256
03:11:55.220178 IP SAMWIN7TESTPC.1947 > BUILDBOX8.57502: FP 5841:6934(1093) ack 1004 win 256
03:11:55.220183 IP BUILDBOX8.57502 > SAMWIN7TESTPC.1947: . ack 6935 win 252
03:11:55.220680 IP BUILDBOX8.57502 > SAMWIN7TESTPC.1947: F 1004:1004(0) ack 6935 win 252
03:11:55.220766 IP BUILDBOX8.57503 > scai-pc.pgo.local.1947: S 2423518256:2423518256(0) win 8192 <mss 1460,nop,wscale 8,nop,nop,sackOK>
03:11:55.220863 IP SAMWIN7TESTPC.1947 > BUILDBOX8.57502: . ack 1005 win 256
03:11:55.221073 IP scai-pc.pgo.local.1947 > BUILDBOX8.57503: S 1682776576:1682776576(0) ack 2423518257 win 8192 <mss 1460,nop,wscale 8,nop,nop,sackOK>
03:11:55.221105 IP BUILDBOX8.57503 > scai-pc.pgo.local.1947: . ack 1 win 256
03:11:55.221130 IP BUILDBOX8.57503 > scai-pc.pgo.local.1947: P 1:1004(1003) ack 1 win 256
03:11:55.223107 IP scai-pc.pgo.local.1947 > BUILDBOX8.57503: . 1:1461(1460) ack 1004 win 2053
03:11:55.223107 IP scai-pc.pgo.local.1947 > BUILDBOX8.57503: . 1461:2921(1460) ack 1004 win 2053
03:11:55.223110 IP scai-pc.pgo.local.1947 > BUILDBOX8.57503: . 2921:4381(1460) ack 1004 win 2053
03:11:55.223110 IP scai-pc.pgo.local.1947 > BUILDBOX8.57503: . 4381:5841(1460) ack 1004 win 2053
03:11:55.223110 IP scai-pc.pgo.local.1947 > BUILDBOX8.57503: P 5841:5938(97) ack 1004 win 2053
03:11:55.223111 IP scai-pc.pgo.local.1947 > BUILDBOX8.57503: F 5938:5938(0) ack 1004 win 2053
03:11:55.223136 IP BUILDBOX8.57503 > scai-pc.pgo.local.1947: . ack 5939 win 256
03:11:55.223555 IP BUILDBOX8.57503 > scai-pc.pgo.local.1947: F 1004:1004(0) ack 5939 win 256
03:11:55.223637 IP BUILDBOX8.57504 > Software-ACH.1947: S 2311246426:2311246426(0) win 8192 <mss 1460,nop,wscale 8,nop,nop,sackOK>
03:11:55.223952 IP scai-pc.pgo.local.1947 > BUILDBOX8.57503: . ack 1005 win 2053
03:11:55.224142 IP Software-ACH.1947 > BUILDBOX8.57504: S 2098215995:2098215995(0) ack 2311246427 win 8192 <mss 1460,nop,wscale 8,nop,nop,sackOK>
03:11:55.224179 IP BUILDBOX8.57504 > Software-ACH.1947: . ack 1 win 256
03:11:55.224205 IP BUILDBOX8.57504 > Software-ACH.1947: P 1:1004(1003) ack 1 win 256
03:11:55.227122 IP Software-ACH.1947 > BUILDBOX8.57504: . 1:1461(1460) ack 1004 win 256
03:11:55.227122 IP Software-ACH.1947 > BUILDBOX8.57504: . 1461:2921(1460) ack 1004 win 256
03:11:55.227131 IP BUILDBOX8.57504 > Software-ACH.1947: . ack 2921 win 256
03:11:55.227365 IP Software-ACH.1947 > BUILDBOX8.57504: . 2921:4381(1460) ack 1004 win 256
03:11:55.227462 IP Software-ACH.1947 > BUILDBOX8.57504: . 4381:5841(1460) ack 1004 win 256
03:11:55.227462 IP Software-ACH.1947 > BUILDBOX8.57504: . 5841:7301(1460) ack 1004 win 256
03:11:55.227465 IP Software-ACH.1947 > BUILDBOX8.57504: . 7301:8761(1460) ack 1004 win 256
03:11:55.227470 IP BUILDBOX8.57504 > Software-ACH.1947: . ack 8761 win 256
03:11:55.227876 IP Software-ACH.1947 > BUILDBOX8.57504: . 8761:10221(1460) ack 1004 win 256
03:11:55.227876 IP Software-ACH.1947 > BUILDBOX8.57504: FP 10221:10651(430) ack 1004 win 256
03:11:55.227898 IP BUILDBOX8.57504 > Software-ACH.1947: . ack 10652 win 256
03:11:55.228621 IP BUILDBOX8.57504 > Software-ACH.1947: F 1004:1004(0) ack 10652 win 256
03:11:55.228706 IP BUILDBOX8.57505 > NOHA-PC.1947: S 2830226238:2830226238(0) win 8192 <mss 1460,nop,wscale 8,nop,nop,sackOK>
03:11:55.228845 IP Software-ACH.1947 > BUILDBOX8.57504: . ack 1005 win 256
03:11:55.229237 IP NOHA-PC.1947 > BUILDBOX8.57505: S 4114314463:4114314463(0) ack 2830226239 win 8192 <mss 1460,nop,wscale 8,nop,nop,sackOK>
03:11:55.229272 IP BUILDBOX8.57505 > NOHA-PC.1947: . ack 1 win 256
03:11:55.229300 IP BUILDBOX8.57505 > NOHA-PC.1947: P 1:1004(1003) ack 1 win 256
03:11:55.237768 IP NOHA-PC.1947 > BUILDBOX8.57505: . 1:1461(1460) ack 1004 win 256
03:11:55.237883 IP NOHA-PC.1947 > BUILDBOX8.57505: . 1461:2921(1460) ack 1004 win 256
03:11:55.237885 IP BUILDBOX8.57505 > NOHA-PC.1947: . ack 2921 win 256
03:11:55.238138 IP NOHA-PC.1947 > BUILDBOX8.57505: . 2921:4381(1460) ack 1004 win 256
03:11:55.238232 IP NOHA-PC.1947 > BUILDBOX8.57505: . 4381:5841(1460) ack 1004 win 256
03:11:55.238232 IP NOHA-PC.1947 > BUILDBOX8.57505: FP 5841:5980(139) ack 1004 win 256
03:11:55.238254 IP BUILDBOX8.57505 > NOHA-PC.1947: . ack 5981 win 256
03:11:55.238674 IP BUILDBOX8.57505 > NOHA-PC.1947: F 1004:1004(0) ack 5981 win 256
03:11:55.238759 IP BUILDBOX8.57506 > ddkf5yf2.pgo.local.1947: S 4148485099:4148485099(0) win 8192 <mss 1460,nop,wscale 8,nop,nop,sackOK>
03:11:55.238941 IP NOHA-PC.1947 > BUILDBOX8.57505: . ack 1005 win 256
03:11:55.239385 IP ddkf5yf2.pgo.local.1947 > BUILDBOX8.57506: S 3212855184:3212855184(0) ack 4148485100 win 8192 <mss 1460,nop,wscale 8,nop,nop,sackOK>
03:11:55.239407 IP BUILDBOX8.57506 > ddkf5yf2.pgo.local.1947: . ack 1 win 256
03:11:55.239447 IP BUILDBOX8.57506 > ddkf5yf2.pgo.local.1947: P 1:1004(1003) ack 1 win 256
03:11:55.241220 IP ddkf5yf2.pgo.local.1947 > BUILDBOX8.57506: . 1:1461(1460) ack 1004 win 256
03:11:55.241458 IP ddkf5yf2.pgo.local.1947 > BUILDBOX8.57506: . 1461:2921(1460) ack 1004 win 256
03:11:55.241463 IP BUILDBOX8.57506 > ddkf5yf2.pgo.local.1947: . ack 2921 win 256
03:11:55.241549 IP ddkf5yf2.pgo.local.1947 > BUILDBOX8.57506: . 2921:4381(1460) ack 1004 win 256
03:11:55.241708 IP ddkf5yf2.pgo.local.1947 > BUILDBOX8.57506: . 4381:5841(1460) ack 1004 win 256
03:11:55.241712 IP BUILDBOX8.57506 > ddkf5yf2.pgo.local.1947: . ack 5841 win 256
03:11:55.242340 IP ddkf5yf2.pgo.local.1947 > BUILDBOX8.57506: . 5841:7301(1460) ack 1004 win 256
03:11:55.242535 IP ddkf5yf2.pgo.local.1947 > BUILDBOX8.57506: . 7301:8761(1460) ack 1004 win 256
03:11:55.242540 IP BUILDBOX8.57506 > ddkf5yf2.pgo.local.1947: . ack 8761 win 256
03:11:55.242626 IP ddkf5yf2.pgo.local.1947 > BUILDBOX8.57506: . 8761:10221(1460) ack 1004 win 256
03:11:55.242786 IP ddkf5yf2.pgo.local.1947 > BUILDBOX8.57506: . 10221:11681(1460) ack 1004 win 256
03:11:55.242791 IP BUILDBOX8.57506 > ddkf5yf2.pgo.local.1947: . ack 11681 win 256
03:11:55.242876 IP ddkf5yf2.pgo.local.1947 > BUILDBOX8.57506: . 11681:13141(1460) ack 1004 win 256
03:11:55.243030 IP ddkf5yf2.pgo.local.1947 > BUILDBOX8.57506: . 13141:14601(1460) ack 1004 win 256
03:11:55.243030 IP ddkf5yf2.pgo.local.1947 > BUILDBOX8.57506: FP 14601:14719(118) ack 1004 win 256
03:11:55.243053 IP BUILDBOX8.57506 > ddkf5yf2.pgo.local.1947: . ack 14720 win 256
03:11:55.244068 IP BUILDBOX8.57506 > ddkf5yf2.pgo.local.1947: F 1004:1004(0) ack 14720 win 256
03:11:55.244154 IP BUILDBOX8.57507 > d9142gy1.pgo.local.1947: S 3847508331:3847508331(0) win 8192 <mss 1460,nop,wscale 8,nop,nop,sackOK>
03:11:55.244452 IP d9142gy1.pgo.local.1947 > BUILDBOX8.57507: S 4245491071:4245491071(0) ack 3847508332 win 8192 <mss 1460,nop,wscale 8,nop,nop,sackOK>
03:11:55.244489 IP BUILDBOX8.57507 > d9142gy1.pgo.local.1947: . ack 1 win 256
03:11:55.244515 IP BUILDBOX8.57507 > d9142gy1.pgo.local.1947: P 1:1004(1003) ack 1 win 256
03:11:55.244764 IP ddkf5yf2.pgo.local.1947 > BUILDBOX8.57506: . ack 1005 win 256
03:11:55.246384 IP d9142gy1.pgo.local.1947 > BUILDBOX8.57507: . 1:1461(1460) ack 1004 win 2053
03:11:55.246549 IP d9142gy1.pgo.local.1947 > BUILDBOX8.57507: . 1461:2921(1460) ack 1004 win 2053
03:11:55.246553 IP BUILDBOX8.57507 > d9142gy1.pgo.local.1947: . ack 2921 win 256
03:11:55.246643 IP d9142gy1.pgo.local.1947 > BUILDBOX8.57507: . 2921:4381(1460) ack 1004 win 2053
03:11:55.246795 IP d9142gy1.pgo.local.1947 > BUILDBOX8.57507: P 4381:5778(1397) ack 1004 win 2053
03:11:55.246796 IP d9142gy1.pgo.local.1947 > BUILDBOX8.57507: F 5778:5778(0) ack 1004 win 2053
03:11:55.246803 IP BUILDBOX8.57507 > d9142gy1.pgo.local.1947: . ack 5779 win 256
03:11:55.247253 IP BUILDBOX8.57507 > d9142gy1.pgo.local.1947: F 1004:1004(0) ack 5779 win 256
03:11:55.247340 IP BUILDBOX8.57508 > martins-pc.pgo.local.1947: S 265747398:265747398(0) win 8192 <mss 1460,nop,wscale 8,nop,nop,sackOK>
03:11:55.247713 IP d9142gy1.pgo.local.1947 > BUILDBOX8.57507: . ack 1005 win 2053
03:11:55.247916 IP martins-pc.pgo.local.1947 > BUILDBOX8.57508: S 2238806783:2238806783(0) ack 265747399 win 8192 <mss 1460,nop,wscale 8,nop,nop,sackOK>
03:11:55.247933 IP BUILDBOX8.57508 > martins-pc.pgo.local.1947: . ack 1 win 256
03:11:55.247974 IP BUILDBOX8.57508 > martins-pc.pgo.local.1947: P 1:1004(1003) ack 1 win 256
03:11:55.252421 IP martins-pc.pgo.local.1947 > BUILDBOX8.57508: . 1:1461(1460) ack 1004 win 256
03:11:55.252504 IP martins-pc.pgo.local.1947 > BUILDBOX8.57508: . 1461:2921(1460) ack 1004 win 256
03:11:55.252504 IP martins-pc.pgo.local.1947 > BUILDBOX8.57508: . 2921:4381(1460) ack 1004 win 256
03:11:55.252505 IP martins-pc.pgo.local.1947 > BUILDBOX8.57508: . 4381:5841(1460) ack 1004 win 256
03:11:55.252513 IP BUILDBOX8.57508 > martins-pc.pgo.local.1947: . ack 5841 win 256
03:11:55.252895 IP martins-pc.pgo.local.1947 > BUILDBOX8.57508: . 5841:7301(1460) ack 1004 win 256
03:11:55.252895 IP martins-pc.pgo.local.1947 > BUILDBOX8.57508: FP 7301:7998(697) ack 1004 win 256
03:11:55.252909 IP BUILDBOX8.57508 > martins-pc.pgo.local.1947: . ack 7999 win 256
03:11:55.253464 IP BUILDBOX8.57508 > martins-pc.pgo.local.1947: F 1004:1004(0) ack 7999 win 256
03:11:55.253544 IP BUILDBOX8.57509 > D4GVKP02.1947: S 3965715347:3965715347(0) win 8192 <mss 1460,nop,wscale 8,nop,nop,sackOK>
03:11:55.253895 IP martins-pc.pgo.local.1947 > BUILDBOX8.57508: . ack 1005 win 256
03:11:55.254094 IP D4GVKP02.1947 > BUILDBOX8.57509: S 3376675701:3376675701(0) ack 3965715348 win 8192 <mss 1460,nop,wscale 8,nop,nop,sackOK>
03:11:55.254117 IP BUILDBOX8.57509 > D4GVKP02.1947: . ack 1 win 256
03:11:55.254157 IP BUILDBOX8.57509 > D4GVKP02.1947: P 1:1004(1003) ack 1 win 256
03:11:55.260454 IP D4GVKP02.1947 > BUILDBOX8.57509: . 1:1461(1460) ack 1004 win 256
03:11:55.260456 IP D4GVKP02.1947 > BUILDBOX8.57509: . 1461:2921(1460) ack 1004 win 256
03:11:55.260456 IP D4GVKP02.1947 > BUILDBOX8.57509: . 2921:4381(1460) ack 1004 win 256
03:11:55.260457 IP D4GVKP02.1947 > BUILDBOX8.57509: . 4381:5841(1460) ack 1004 win 256
03:11:55.260474 IP BUILDBOX8.57509 > D4GVKP02.1947: . ack 5841 win 256
03:11:55.260997 IP D4GVKP02.1947 > BUILDBOX8.57509: FP 5841:6898(1057) ack 1004 win 256
03:11:55.261006 IP BUILDBOX8.57509 > D4GVKP02.1947: . ack 6899 win 252
03:11:55.261495 IP BUILDBOX8.57509 > D4GVKP02.1947: F 1004:1004(0) ack 6899 win 252
03:11:55.261578 IP BUILDBOX8.57510 > HAROLD-PC.1947: S 1269344707:1269344707(0) win 8192 <mss 1460,nop,wscale 8,nop,nop,sackOK>
03:11:55.261870 IP D4GVKP02.1947 > BUILDBOX8.57509: . ack 1005 win 256
03:11:55.262198 IP HAROLD-PC.1947 > BUILDBOX8.57510: S 1939734785:1939734785(0) ack 1269344708 win 8192 <mss 1460,nop,wscale 8,nop,nop,sackOK>
03:11:55.262223 IP BUILDBOX8.57510 > HAROLD-PC.1947: . ack 1 win 256
03:11:55.262264 IP BUILDBOX8.57510 > HAROLD-PC.1947: P 1:1004(1003) ack 1 win 256
03:11:55.263472 arp who-has 192.168.20.19 tell BUILDBOX7
03:11:55.264689 IP HAROLD-PC.1947 > BUILDBOX8.57510: . 1:1461(1460) ack 1004 win 256
03:11:55.264917 IP HAROLD-PC.1947 > BUILDBOX8.57510: . 1461:2921(1460) ack 1004 win 256
03:11:55.264921 IP BUILDBOX8.57510 > HAROLD-PC.1947: . ack 2921 win 256
03:11:55.265942 IP HAROLD-PC.1947 > BUILDBOX8.57510: . 2921:4381(1460) ack 1004 win 256
03:11:55.266161 IP HAROLD-PC.1947 > BUILDBOX8.57510: . 4381:5841(1460) ack 1004 win 256
03:11:55.266170 IP BUILDBOX8.57510 > HAROLD-PC.1947: . ack 5841 win 256
03:11:55.266238 IP HAROLD-PC.1947 > BUILDBOX8.57510: . 5841:7301(1460) ack 1004 win 256
03:11:55.266411 IP HAROLD-PC.1947 > BUILDBOX8.57510: . 7301:8761(1460) ack 1004 win 256
03:11:55.266416 IP BUILDBOX8.57510 > HAROLD-PC.1947: . ack 8761 win 256
03:11:55.266845 IP HAROLD-PC.1947 > BUILDBOX8.57510: . 8761:10221(1460) ack 1004 win 256
03:11:55.267080 IP HAROLD-PC.1947 > BUILDBOX8.57510: . 10221:11681(1460) ack 1004 win 256
03:11:55.267084 IP BUILDBOX8.57510 > HAROLD-PC.1947: . ack 11681 win 256
03:11:55.267161 IP HAROLD-PC.1947 > BUILDBOX8.57510: . 11681:13141(1460) ack 1004 win 256
03:11:55.267333 IP HAROLD-PC.1947 > BUILDBOX8.57510: . 13141:14601(1460) ack 1004 win 256
03:11:55.267337 IP BUILDBOX8.57510 > HAROLD-PC.1947: . ack 14601 win 256
03:11:55.267414 IP HAROLD-PC.1947 > BUILDBOX8.57510: . 14601:16061(1460) ack 1004 win 256
03:11:55.267580 IP HAROLD-PC.1947 > BUILDBOX8.57510: . 16061:17521(1460) ack 1004 win 256
03:11:55.267584 IP BUILDBOX8.57510 > HAROLD-PC.1947: . ack 17521 win 256
03:11:55.267661 IP HAROLD-PC.1947 > BUILDBOX8.57510: . 17521:18981(1460) ack 1004 win 256
03:11:55.267834 IP HAROLD-PC.1947 > BUILDBOX8.57510: . 18981:20441(1460) ack 1004 win 256
03:11:55.267836 IP BUILDBOX8.57510 > HAROLD-PC.1947: . ack 20441 win 256
03:11:55.267913 IP HAROLD-PC.1947 > BUILDBOX8.57510: . 20441:21901(1460) ack 1004 win 256
03:11:55.268070 IP HAROLD-PC.1947 > BUILDBOX8.57510: . 21901:23361(1460) ack 1004 win 256
03:11:55.268075 IP BUILDBOX8.57510 > HAROLD-PC.1947: . ack 23361 win 256
03:11:55.268151 IP HAROLD-PC.1947 > BUILDBOX8.57510: . 23361:24821(1460) ack 1004 win 256
03:11:55.268243 IP HAROLD-PC.1947 > BUILDBOX8.57510: . 24821:26281(1460) ack 1004 win 256
03:11:55.268248 IP BUILDBOX8.57510 > HAROLD-PC.1947: . ack 26281 win 256
03:11:55.268325 IP HAROLD-PC.1947 > BUILDBOX8.57510: . 26281:27741(1460) ack 1004 win 256
03:11:55.268493 IP HAROLD-PC.1947 > BUILDBOX8.57510: . 27741:29201(1460) ack 1004 win 256
03:11:55.268498 IP BUILDBOX8.57510 > HAROLD-PC.1947: . ack 29201 win 256
03:11:55.268574 IP HAROLD-PC.1947 > BUILDBOX8.57510: . 29201:30661(1460) ack 1004 win 256
03:11:55.268737 IP HAROLD-PC.1947 > BUILDBOX8.57510: . 30661:32121(1460) ack 1004 win 256
03:11:55.268742 IP BUILDBOX8.57510 > HAROLD-PC.1947: . ack 32121 win 256
03:11:55.268825 IP HAROLD-PC.1947 > BUILDBOX8.57510: . 32121:33581(1460) ack 1004 win 256
03:11:55.268986 IP HAROLD-PC.1947 > BUILDBOX8.57510: . 33581:35041(1460) ack 1004 win 256
03:11:55.268991 IP BUILDBOX8.57510 > HAROLD-PC.1947: . ack 35041 win 256
03:11:55.269068 IP HAROLD-PC.1947 > BUILDBOX8.57510: . 35041:36501(1460) ack 1004 win 256
03:11:55.269231 IP HAROLD-PC.1947 > BUILDBOX8.57510: . 36501:37961(1460) ack 1004 win 256
03:11:55.269236 IP BUILDBOX8.57510 > HAROLD-PC.1947: . ack 37961 win 256
03:11:55.269313 IP HAROLD-PC.1947 > BUILDBOX8.57510: . 37961:39421(1460) ack 1004 win 256
03:11:55.269479 IP HAROLD-PC.1947 > BUILDBOX8.57510: . 39421:40881(1460) ack 1004 win 256
03:11:55.269484 IP BUILDBOX8.57510 > HAROLD-PC.1947: . ack 40881 win 256
03:11:55.269561 IP HAROLD-PC.1947 > BUILDBOX8.57510: . 40881:42341(1460) ack 1004 win 256
03:11:55.269724 IP HAROLD-PC.1947 > BUILDBOX8.57510: . 42341:43801(1460) ack 1004 win 256
03:11:55.269730 IP BUILDBOX8.57510 > HAROLD-PC.1947: . ack 43801 win 256
03:11:55.269808 IP HAROLD-PC.1947 > BUILDBOX8.57510: . 43801:45261(1460) ack 1004 win 256
03:11:55.269970 IP HAROLD-PC.1947 > BUILDBOX8.57510: . 45261:46721(1460) ack 1004 win 256
03:11:55.269975 IP BUILDBOX8.57510 > HAROLD-PC.1947: . ack 46721 win 256
03:11:55.270052 IP HAROLD-PC.1947 > BUILDBOX8.57510: . 46721:48181(1460) ack 1004 win 256
03:11:55.270219 IP HAROLD-PC.1947 > BUILDBOX8.57510: . 48181:49641(1460) ack 1004 win 256
03:11:55.270225 IP BUILDBOX8.57510 > HAROLD-PC.1947: . ack 49641 win 256
03:11:55.270303 IP HAROLD-PC.1947 > BUILDBOX8.57510: . 49641:51101(1460) ack 1004 win 256
03:11:55.270466 IP HAROLD-PC.1947 > BUILDBOX8.57510: . 51101:52561(1460) ack 1004 win 256
03:11:55.270471 IP BUILDBOX8.57510 > HAROLD-PC.1947: . ack 52561 win 256
03:11:55.270547 IP HAROLD-PC.1947 > BUILDBOX8.57510: . 52561:54021(1460) ack 1004 win 256
03:11:55.270713 IP HAROLD-PC.1947 > BUILDBOX8.57510: . 54021:55481(1460) ack 1004 win 256
03:11:55.270718 IP BUILDBOX8.57510 > HAROLD-PC.1947: . ack 55481 win 256
03:11:55.270794 IP HAROLD-PC.1947 > BUILDBOX8.57510: . 55481:56941(1460) ack 1004 win 256
03:11:55.270896 IP HAROLD-PC.1947 > BUILDBOX8.57510: FP 56941:57485(544) ack 1004 win 256
03:11:55.270904 IP BUILDBOX8.57510 > HAROLD-PC.1947: . ack 57486 win 256
03:11:55.274711 IP BUILDBOX8.57510 > HAROLD-PC.1947: F 1004:1004(0) ack 57486 win 256
03:11:55.275514 IP HAROLD-PC.1947 > BUILDBOX8.57510: . ack 1005 win 256
03:11:55.343018 arp who-has ddkf5yf2.pgo.local tell vCenter
03:11:55.343021 arp who-has D10X0T92 tell vCenter
03:11:55.454164 arp who-has D10X0T92 tell vCenter
03:11:55.454342 arp who-has 192.168.20.120 tell vCenter
03:11:55.560979 arp who-has 192.168.20.249 tell orders_fax.pgo.local
03:11:55.703945 IP ddkf5yf2.pgo.local.3976 > BUILDBOX8.1947: S 4055912351:4055912351(0) win 8192 <mss 1460,nop,wscale 8,nop,nop,sackOK>
03:11:55.704050 IP BUILDBOX8.1947 > ddkf5yf2.pgo.local.3976: S 124548468:124548468(0) ack 4055912352 win 8192 <mss 1460,nop,wscale 8,nop,nop,sackOK>
03:11:55.704607 IP ddkf5yf2.pgo.local.3976 > BUILDBOX8.1947: . ack 1 win 256
03:11:55.704721 IP ddkf5yf2.pgo.local.3976 > BUILDBOX8.1947: P 1:254(253) ack 1 win 256
03:11:55.705234 IP BUILDBOX8.1947 > ddkf5yf2.pgo.local.3976: P 1:222(221) ack 254 win 256
03:11:55.705262 IP BUILDBOX8.1947 > ddkf5yf2.pgo.local.3976: F 222:222(0) ack 254 win 256
03:11:55.705885 IP ddkf5yf2.pgo.local.3976 > BUILDBOX8.1947: . ack 223 win 255
03:11:55.705888 IP ddkf5yf2.pgo.local.3976 > BUILDBOX8.1947: F 254:254(0) ack 223 win 255
03:11:55.705907 IP BUILDBOX8.1947 > ddkf5yf2.pgo.local.3976: . ack 255 win 256
03:11:55.705987 IP ddkf5yf2.pgo.local.3795 > BUILDBOX8.1947: F 1526924564:1526924564(0) ack 1980508996 win 252
03:11:55.705996 IP BUILDBOX8.1947 > ddkf5yf2.pgo.local.3795: . ack 1 win 256
03:11:55.770058 78:44:76:7d:b2:2f (oui Unknown) > Broadcast Null Unnumbered, xid, Flags [Response], length 46: 01 00
03:11:55.774748 arp who-has 192.168.20.20 tell ddkf5yf2.pgo.local
03:11:55.789833 802.1d unknown version
03:11:56.210080 IP ddyxly1s.63658 > 239.255.255.250.1900: UDP, length 174
03:11:56.272508 arp who-has 192.168.20.1 tell kyoscanner.pgo.local
03:11:56.343054 arp who-has D10X0T92 tell vCenter
03:11:56.343108 arp who-has 192.168.20.120 tell vCenter
03:11:56.558340 arp who-has 192.168.20.249 tell orders_fax.pgo.local
03:11:56.706242 arp who-has 192.168.20.20 tell ddkf5yf2.pgo.local
03:11:56.712034 EAP code=2 id=0 length=5 
03:11:56.794063 78:44:76:7d:b2:2f (oui Unknown) > Broadcast Null Unnumbered, xid, Flags [Response], length 46: 01 00
03:11:57.059149 arp who-has 192.168.20.55 tell 192.168.20.21
03:11:57.210308 IP ddyxly1s.63658 > 239.255.255.250.1900: UDP, length 174
03:11:57.343192 arp who-has D10X0T92 tell vCenter
03:11:57.346110 arp who-has 192.168.20.120 tell vCenter
03:11:57.372464 arp who-has 192.168.20.1 tell kyoscanner.pgo.local
03:11:57.558366 arp who-has 192.168.20.249 tell orders_fax.pgo.local
03:11:57.705921 arp who-has 192.168.20.20 tell ddkf5yf2.pgo.local
03:11:57.712255 EAP code=2 id=0 length=5 
03:11:57.752607 IP Marks-Laptop.49561 > 192.168.20.255.1947: UDP, length 40
03:11:57.752751 IP BUILDBOX8.1947 > Marks-Laptop.49561: UDP, length 40
03:11:57.791181 802.1d unknown version
03:11:57.818230 78:44:76:7d:b2:2f (oui Unknown) > Broadcast Null Unnumbered, xid, Flags [Response], length 46: 01 00
03:11:58.210398 IP ddyxly1s.63658 > 239.255.255.250.1900: UDP, length 174
03:11:58.343325 arp who-has d3xb2lg2.pgo.local tell vCenter
03:11:58.463245 arp who-has 192.168.20.120 tell vCenter
03:11:58.472538 arp who-has 192.168.20.1 tell kyoscanner.pgo.local
03:11:58.568293 arp who-has d3xb2lg2.pgo.local tell vCenter
03:11:58.568542 arp who-has D10X0T92 tell vCenter
03:11:58.769102 IP ddkf5yf2.pgo.local.3980 > BUILDBOX8.1947: S 3874614854:3874614854(0) win 8192 <mss 1460,nop,wscale 8,nop,nop,sackOK>
03:11:58.769192 IP BUILDBOX8.1947 > ddkf5yf2.pgo.local.3980: S 2421720990:2421720990(0) ack 3874614855 win 8192 <mss 1460,nop,wscale 8,nop,nop,sackOK>
03:11:58.769704 IP ddkf5yf2.pgo.local.3980 > BUILDBOX8.1947: . ack 1 win 256
03:11:58.769904 IP ddkf5yf2.pgo.local.3980 > BUILDBOX8.1947: P 1:254(253) ack 1 win 256
03:11:58.770239 IP BUILDBOX8.1947 > ddkf5yf2.pgo.local.3980: P 1:222(221) ack 254 win 256
03:11:58.770266 IP BUILDBOX8.1947 > ddkf5yf2.pgo.local.3980: F 222:222(0) ack 254 win 256
03:11:58.770890 IP ddkf5yf2.pgo.local.3980 > BUILDBOX8.1947: . ack 223 win 255
03:11:58.770890 IP ddkf5yf2.pgo.local.3980 > BUILDBOX8.1947: F 254:254(0) ack 223 win 255
03:11:58.770907 IP BUILDBOX8.1947 > ddkf5yf2.pgo.local.3980: . ack 255 win 256
03:11:58.771022 IP ddkf5yf2.pgo.local.3791 > BUILDBOX8.1947: F 3866946957:3866946957(0) ack 1628201730 win 252
03:11:58.771032 IP BUILDBOX8.1947 > ddkf5yf2.pgo.local.3791: . ack 1 win 256
03:11:58.944314 78:44:76:7d:b2:2f (oui Unknown) > Broadcast Null Unnumbered, xid, Flags [Response], length 46: 01 00
03:11:59.054181 arp who-has Pras-PC tell vCenter
03:11:59.061422 arp who-has SOFTWARE-ATH tell HAROLD-PC
03:11:59.095022 arp who-has d9142gy1.pgo.local tell HAROLD-PC
03:11:59.120932 arp who-has BUILDBOX7 tell HAROLD-PC
03:11:59.210452 IP ddyxly1s.63658 > 239.255.255.250.1900: UDP, length 174
03:11:59.343379 arp who-has 192.168.20.120 tell vCenter
03:11:59.343381 arp who-has d3xb2lg2.pgo.local tell vCenter
03:11:59.343382 arp who-has D10X0T92 tell vCenter
03:11:59.346434 arp who-has pgointra02.pgo.local tell wcmdc02.pgo.local
03:11:59.522822 arp who-has 192.168.20.20 tell ddkf5yf2.pgo.local
03:11:59.572612 arp who-has 192.168.20.1 tell kyoscanner.pgo.local
03:11:59.595764 arp who-has SAML-PC.pgo.local tell 192.168.20.21
03:11:59.792373 802.1d unknown version
03:11:59.825405 arp who-has wcmdc02.pgo.local tell tstw2008svr.pgo.local
03:11:59.825776 arp who-has tstw2008svr.pgo.local tell wcmdc02.pgo.local
03:11:59.843293 arp who-has Pras-PC tell vCenter
03:12:00.070976 78:44:76:7d:b2:2f (oui Unknown) > Broadcast Null Unnumbered, xid, Flags [Response], length 46: 01 00
03:12:00.179489 IP server2k3-vdc.pgo.local.137 > 192.168.20.255.137: UDP, length 50
03:12:00.205721 arp who-has 192.168.20.20 tell ddkf5yf2.pgo.local
03:12:00.342310 arp who-has 192.168.20.120 tell vCenter
03:12:00.342337 arp who-has d3xb2lg2.pgo.local tell vCenter
03:12:00.342338 arp who-has D10X0T92 tell vCenter
03:12:00.533995 IP ddkf5yf2.pgo.local.3981 > BUILDBOX8.1947: S 2078457415:2078457415(0) win 8192 <mss 1460,nop,wscale 8,nop,nop,sackOK>
03:12:00.534088 IP BUILDBOX8.1947 > ddkf5yf2.pgo.local.3981: S 1604343244:1604343244(0) ack 2078457416 win 8192 <mss 1460,nop,wscale 8,nop,nop,sackOK>
03:12:00.534629 IP ddkf5yf2.pgo.local.3981 > BUILDBOX8.1947: . ack 1 win 256
03:12:00.534828 IP ddkf5yf2.pgo.local.3981 > BUILDBOX8.1947: P 1:254(253) ack 1 win 256
03:12:00.535144 IP BUILDBOX8.1947 > ddkf5yf2.pgo.local.3981: P 1:222(221) ack 254 win 256
03:12:00.535169 IP BUILDBOX8.1947 > ddkf5yf2.pgo.local.3981: F 222:222(0) ack 254 win 256
03:12:00.535763 IP ddkf5yf2.pgo.local.3981 > BUILDBOX8.1947: . ack 223 win 255
03:12:00.535783 IP ddkf5yf2.pgo.local.3981 > BUILDBOX8.1947: F 254:254(0) ack 223 win 255
03:12:00.535797 IP BUILDBOX8.1947 > ddkf5yf2.pgo.local.3981: . ack 255 win 256
03:12:00.673319 arp who-has 192.168.20.1 tell kyoscanner.pgo.local
03:12:00.779974 IP scai-pc.pgo.local.64350 > 255.255.255.255.1947: UDP, length 40
03:12:00.780137 IP BUILDBOX8.1947 > scai-pc.pgo.local.64350: UDP, length 40
03:12:00.842429 arp who-has Pras-PC tell vCenter
03:12:00.924084 IP server2k3-vdc.pgo.local.137 > 192.168.20.255.137: UDP, length 50
03:12:01.099150 78:44:76:7d:b2:2f (oui Unknown) > Broadcast Null Unnumbered, xid, Flags [Response], length 46: 01 00
03:12:01.206273 arp who-has 192.168.20.20 tell ddkf5yf2.pgo.local
03:12:01.239002 arp who-has pgorat.pgo.local tell SOFTWARE-ATH
03:12:01.342395 arp who-has 192.168.20.15 tell vCenter
03:12:01.567456 arp who-has D10X0T92 tell vCenter
03:12:01.581347 arp who-has 192.168.20.249 tell orders_fax.pgo.local
03:12:01.673166 IP server2k3-vdc.pgo.local.137 > 192.168.20.255.137: UDP, length 50
03:12:01.679605 arp who-has 192.168.20.15 tell vCenter
03:12:01.679711 arp who-has d3xb2lg2.pgo.local tell vCenter
03:12:01.771168 IP KKing-PC.54167 > 239.255.255.250.1900: UDP, length 174
03:12:01.772876 arp who-has 192.168.20.1 tell kyoscanner.pgo.local
03:12:01.791103 802.1d unknown version
03:12:01.897563 IP ddkf5yf2.pgo.local.3983 > BUILDBOX8.1947: S 1594988652:1594988652(0) win 8192 <mss 1460,nop,wscale 8,nop,nop,sackOK>
03:12:01.897643 IP BUILDBOX8.1947 > ddkf5yf2.pgo.local.3983: S 826575310:826575310(0) ack 1594988653 win 8192 <mss 1460,nop,wscale 8,nop,nop,sackOK>
03:12:01.898171 IP ddkf5yf2.pgo.local.3983 > BUILDBOX8.1947: . ack 1 win 256
03:12:01.898333 IP ddkf5yf2.pgo.local.3983 > BUILDBOX8.1947: P 1:254(253) ack 1 win 256
03:12:01.900666 IP BUILDBOX8.1947 > ddkf5yf2.pgo.local.3983: P 1:222(221) ack 254 win 256
03:12:01.900730 IP BUILDBOX8.1947 > ddkf5yf2.pgo.local.3983: F 222:222(0) ack 254 win 256
03:12:01.901266 IP ddkf5yf2.pgo.local.3983 > BUILDBOX8.1947: . ack 223 win 255
03:12:01.901332 IP ddkf5yf2.pgo.local.3983 > BUILDBOX8.1947: F 254:254(0) ack 223 win 255
03:12:01.901346 IP BUILDBOX8.1947 > ddkf5yf2.pgo.local.3983: . ack 255 win 256
03:12:02.058039 arp who-has 192.168.20.55 tell 192.168.20.21
03:12:02.119010 78:44:76:7d:b2:2f (oui Unknown) > Broadcast Null Unnumbered, xid, Flags [Response], length 46: 01 00
03:12:02.161215 arp who-has DESKTOP-PPOP81N tell vCenter
03:12:02.342452 arp who-has D10X0T92 tell vCenter
03:12:02.342474 arp who-has 192.168.20.15 tell vCenter
03:12:02.342474 arp who-has d3xb2lg2.pgo.local tell vCenter
03:12:02.430472 IP server2k3-vdc.pgo.local.137 > 192.168.20.255.137: UDP, length 50
03:12:02.578598 arp who-has 192.168.20.249 tell orders_fax.pgo.local
03:12:02.772317 IP KKing-PC.54167 > 239.255.255.250.1900: UDP, length 174
03:12:02.842605 arp who-has DESKTOP-PPOP81N tell vCenter
03:12:02.872810 arp who-has 192.168.20.1 tell kyoscanner.pgo.local
03:12:03.142991 78:44:76:7d:b2:2f (oui Unknown) > Broadcast Null Unnumbered, xid, Flags [Response], length 46: 01 00
03:12:03.173234 IP server2k3-vdc.pgo.local.137 > 192.168.20.255.137: UDP, length 50
03:12:03.342579 arp who-has D10X0T92 tell vCenter
03:12:03.344105 arp who-has 192.168.20.15 tell vCenter
03:12:03.344105 arp who-has d3xb2lg2.pgo.local tell vCenter
03:12:03.578704 arp who-has 192.168.20.249 tell orders_fax.pgo.local
03:12:03.737735 IP d1tv4562.pgo.local.62261 > 239.255.255.250.1900: UDP, length 174
03:12:03.772450 IP KKing-PC.54167 > 239.255.255.250.1900: UDP, length 174
03:12:03.772584 arp who-has 192.168.20.20 tell ddkf5yf2.pgo.local
03:12:03.791179 802.1d unknown version
03:12:03.792919 00:24:a8:68:11:c0 (oui Unknown) > 01:80:c2:00:00:0e (oui Unknown), ethertype Unknown (0x88cc), length 190: 
	0x0000:  0207 0400 24a8 6801 0004 0307 3634 0602  ....$.h.....64..
	0x0010:  0078 0803 4331 360a 1650 726f 4375 7276  .x..C16..ProCurv
	0x0020:  655f 5357 5f35 3431 327a 6c5f 5072 690c  e_SW_5412zl_Pri.
	0x0030:  5650 726f 4375 7276 6520 4a38 3639 3841  VProCurve.J8698A
	0x0040:  2053 7769 7463 6820 3534 3132 7a6c 2c20  .Switch.5412zl,.
	0x0050:  7265                                     re
03:12:03.842613 arp who-has DESKTOP-PPOP81N tell vCenter
03:12:03.923327 IP server2k3-vdc.pgo.local.137 > 192.168.20.255.137: UDP, length 50
03:12:03.924486 IP ddmynb1s1.pgo.local.1038 > 255.255.255.255.1947: UDP, length 40
03:12:03.924646 IP BUILDBOX8.1947 > ddmynb1s1.pgo.local.1038: UDP, length 40
03:12:03.973011 arp who-has 192.168.20.1 tell kyoscanner.pgo.local
03:12:04.167034 78:44:76:7d:b2:2f (oui Unknown) > Broadcast Null Unnumbered, xid, Flags [Response], length 46: 01 00
03:12:04.342599 arp who-has D10X0T92 tell vCenter
03:12:04.454608 arp who-has 192.168.20.120 tell vCenter
03:12:04.578910 arp who-has 192.168.20.249 tell orders_fax.pgo.local
03:12:04.674838 arp who-has d3xb2lg2.pgo.local tell vCenter
03:12:04.705673 arp who-has 192.168.20.20 tell ddkf5yf2.pgo.local
03:12:04.738835 IP d1tv4562.pgo.local.62261 > 239.255.255.250.1900: UDP, length 174
03:12:04.772543 IP KKing-PC.54167 > 239.255.255.250.1900: UDP, length 174
03:12:04.786276 IP scai-pc.pgo.local.64350 > 192.168.20.255.1947: UDP, length 40
03:12:04.786414 IP BUILDBOX8.1947 > scai-pc.pgo.local.64350: UDP, length 40
03:12:04.790412 arp who-has SOFTWARE-ATH tell Irina-pc
03:12:04.790666 arp who-has D10X0T92 tell vCenter
03:12:04.790885 arp who-has 192.168.20.15 tell vCenter
03:12:04.793373 IP Irina-pc.61917 > BUILDBOX8.1947: S 2774396239:2774396239(0) win 8192 <mss 1460,nop,wscale 8,nop,nop,sackOK>
03:12:04.793448 IP BUILDBOX8.1947 > Irina-pc.61917: S 1358843170:1358843170(0) ack 2774396240 win 8192 <mss 1460,nop,wscale 8,nop,nop,sackOK>
03:12:04.793572 IP Irina-pc.61917 > BUILDBOX8.1947: . ack 1 win 256
03:12:04.793672 IP Irina-pc.61917 > BUILDBOX8.1947: P 1:934(933) ack 1 win 256
03:12:04.815760 IP server2k3-vdc.pgo.local.137 > 192.168.20.255.137: UDP, length 50
03:12:04.842587 IP bad-len 0
03:12:04.842919 IP Irina-pc.61917 > BUILDBOX8.1947: . ack 2921 win 256
03:12:04.842935 IP bad-len 0
03:12:04.843160 IP Irina-pc.61917 > BUILDBOX8.1947: . ack 8761 win 256
03:12:04.843169 IP bad-len 0
03:12:04.843405 IP Irina-pc.61917 > BUILDBOX8.1947: . ack 16061 win 256
03:12:04.843423 IP bad-len 0
03:12:04.843683 IP Irina-pc.61917 > BUILDBOX8.1947: . ack 20441 win 256
03:12:04.843684 IP Irina-pc.61917 > BUILDBOX8.1947: . ack 30661 win 250
03:12:04.843692 IP BUILDBOX8.1947 > Irina-pc.61917: FP 33581:33601(20) ack 934 win 256
03:12:04.843821 IP Irina-pc.61917 > BUILDBOX8.1947: . ack 30661 win 256
03:12:04.843821 IP Irina-pc.61917 > BUILDBOX8.1947: . ack 33581 win 256
03:12:04.844354 IP Irina-pc.61917 > BUILDBOX8.1947: . ack 33602 win 256
03:12:04.844682 IP Irina-pc.61917 > BUILDBOX8.1947: F 934:934(0) ack 33602 win 256
03:12:04.844696 IP BUILDBOX8.1947 > Irina-pc.61917: . ack 935 win 256
03:12:05.072954 arp who-has 192.168.20.1 tell kyoscanner.pgo.local
03:12:05.192375 78:44:76:7d:b2:2f (oui Unknown) > Broadcast Null Unnumbered, xid, Flags [Response], length 46: 01 00
03:12:05.287859 arp who-has SAML-PC.pgo.local tell 192.168.20.22
03:12:05.342656 arp who-has 192.168.20.120 tell vCenter
03:12:05.342656 arp who-has d3xb2lg2.pgo.local tell vCenter
03:12:05.342750 arp who-has D10X0T92 tell vCenter
03:12:05.342750 arp who-has 192.168.20.15 tell vCenter
03:12:05.443834 arp who-has wcmdc02.pgo.local tell Marks-Laptop
03:12:05.547417 IP server2k3-vdc.pgo.local.137 > 192.168.20.255.137: UDP, length 50
03:12:05.573475 arp who-has pgointra.pgo.local tell Marks-Laptop
03:12:05.578641 arp who-has 192.168.20.249 tell orders_fax.pgo.local
03:12:05.604671 arp who-has Marks-Laptop tell wcmdc02.pgo.local
03:12:05.701723 IP ddkf5yf2.pgo.local.3988 > BUILDBOX8.1947: S 1374756149:1374756149(0) win 8192 <mss 1460,nop,wscale 8,nop,nop,sackOK>
03:12:05.701805 IP BUILDBOX8.1947 > ddkf5yf2.pgo.local.3988: S 3129573964:3129573964(0) ack 1374756150 win 8192 <mss 1460,nop,wscale 8,nop,nop,sackOK>
03:12:05.702335 IP ddkf5yf2.pgo.local.3988 > BUILDBOX8.1947: . ack 1 win 256
03:12:05.702549 IP ddkf5yf2.pgo.local.3988 > BUILDBOX8.1947: P 1:254(253) ack 1 win 256
03:12:05.703150 IP BUILDBOX8.1947 > ddkf5yf2.pgo.local.3988: P 1:222(221) ack 254 win 256
03:12:05.703202 IP BUILDBOX8.1947 > ddkf5yf2.pgo.local.3988: F 222:222(0) ack 254 win 256
03:12:05.703773 IP ddkf5yf2.pgo.local.3988 > BUILDBOX8.1947: . ack 223 win 255
03:12:05.703776 IP ddkf5yf2.pgo.local.3988 > BUILDBOX8.1947: F 254:254(0) ack 223 win 255
03:12:05.703794 IP BUILDBOX8.1947 > ddkf5yf2.pgo.local.3988: . ack 255 win 256
03:12:05.706343 arp who-has 192.168.20.20 tell ddkf5yf2.pgo.local
03:12:05.739602 IP d1tv4562.pgo.local.62261 > 239.255.255.250.1900: UDP, length 174
03:12:05.791287 802.1d unknown version
03:12:05.840298 IP Marks-Laptop.58176 > BUILDBOX8.1947: S 546138687:546138687(0) win 8192 <mss 1460,nop,wscale 8,nop,nop,sackOK>
03:12:05.840378 IP BUILDBOX8.1947 > Marks-Laptop.58176: S 1120017219:1120017219(0) ack 546138688 win 8192 <mss 1460,nop,wscale 8,nop,nop,sackOK>
03:12:05.840632 IP Marks-Laptop.58176 > BUILDBOX8.1947: . ack 1 win 256
03:12:05.840841 IP Marks-Laptop.58176 > BUILDBOX8.1947: P 1:938(937) ack 1 win 256
03:12:05.845885 IP bad-len 0
03:12:05.846263 IP Marks-Laptop.58176 > BUILDBOX8.1947: . ack 2921 win 256
03:12:05.846276 IP bad-len 0
03:12:05.846771 IP Marks-Laptop.58176 > BUILDBOX8.1947: . ack 8761 win 256
03:12:05.846780 IP bad-len 0
03:12:05.847302 IP Marks-Laptop.58176 > BUILDBOX8.1947: . ack 20441 win 256
03:12:05.847333 IP bad-len 0
03:12:05.847907 IP Marks-Laptop.58176 > BUILDBOX8.1947: . ack 33602 win 256
03:12:05.852364 IP Marks-Laptop.58176 > BUILDBOX8.1947: F 938:938(0) ack 33602 win 256
03:12:05.852377 IP BUILDBOX8.1947 > Marks-Laptop.58176: . ack 939 win 256
03:12:05.852841 arp who-has KKing-PC tell Marks-Laptop
03:12:06.039196 arp who-has KKing-PC tell Software-ACH
03:12:06.079655 arp who-has KKing-PC tell BUILDBOX7
03:12:06.091853 arp who-has SOFTWARE-ATH tell BUILDBOX7
03:12:06.173165 arp who-has 192.168.20.1 tell kyoscanner.pgo.local
03:12:06.297750 IP server2k3-vdc.pgo.local.137 > 192.168.20.255.137: UDP, length 50
03:12:06.317418 78:44:76:7d:b2:2f (oui Unknown) > Broadcast Null Unnumbered, xid, Flags [Response], length 46: 01 00
03:12:06.342836 arp who-has 192.168.20.120 tell vCenter
03:12:06.342836 arp who-has d3xb2lg2.pgo.local tell vCenter
03:12:06.342837 arp who-has D10X0T92 tell vCenter
03:12:06.342837 arp who-has 192.168.20.15 tell vCenter
03:12:06.578789 arp who-has 192.168.20.249 tell orders_fax.pgo.local
03:12:06.598183 IP D4GVKP02.54601 > BUILDBOX8.1947: S 1830732144:1830732144(0) win 8192 <mss 1460,nop,wscale 8,nop,nop,sackOK>
03:12:06.598288 IP BUILDBOX8.1947 > D4GVKP02.54601: S 2675214807:2675214807(0) ack 1830732145 win 8192 <mss 1460,nop,wscale 8,nop,nop,sackOK>
03:12:06.598702 IP D4GVKP02.54601 > BUILDBOX8.1947: . ack 1 win 256
03:12:06.598766 IP D4GVKP02.54601 > BUILDBOX8.1947: P 1:906(905) ack 1 win 256
03:12:06.603810 IP bad-len 0
03:12:06.604347 IP D4GVKP02.54601 > BUILDBOX8.1947: . ack 2921 win 256
03:12:06.604361 IP bad-len 0
03:12:06.604837 IP D4GVKP02.54601 > BUILDBOX8.1947: . ack 8761 win 256
03:12:06.604846 IP bad-len 0
03:12:06.605582 IP D4GVKP02.54601 > BUILDBOX8.1947: . ack 20441 win 256
03:12:06.605600 IP bad-len 0
03:12:06.606418 IP D4GVKP02.54601 > BUILDBOX8.1947: . ack 33602 win 256
03:12:06.607589 IP D4GVKP02.54601 > BUILDBOX8.1947: F 906:906(0) ack 33602 win 256
03:12:06.607603 IP BUILDBOX8.1947 > D4GVKP02.54601: . ack 907 win 256
03:12:06.737450 IP SAMWIN7TESTPC.64415 > 255.255.255.255.1947: UDP, length 40
03:12:06.737627 IP BUILDBOX8.1947 > SAMWIN7TESTPC.64415: UDP, length 40
03:12:06.740424 IP d1tv4562.pgo.local.62261 > 239.255.255.250.1900: UDP, length 174
03:12:07.057083 arp who-has 192.168.20.55 tell 192.168.20.21
03:12:07.257103 arp who-has D6MQ2B92 tell wcmwifi.pgo.local
03:12:07.273081 arp who-has 192.168.20.1 tell kyoscanner.pgo.local
03:12:07.274675 IP server2k3-vdc.pgo.local.137 > 192.168.20.255.137: UDP, length 50
03:12:07.342867 arp who-has d3xb2lg2.pgo.local tell vCenter
03:12:07.352646 78:44:76:7d:b2:2f (oui Unknown) > Broadcast Null Unnumbered, xid, Flags [Response], length 46: 01 00
03:12:07.566827 arp who-has D10X0T92 tell vCenter
03:12:07.581348 arp who-has 192.168.20.249 tell orders_fax.pgo.local
03:12:07.770385 IP ddkf5yf2.pgo.local.3991 > BUILDBOX8.1947: S 4007421107:4007421107(0) win 8192 <mss 1460,nop,wscale 8,nop,nop,sackOK>
03:12:07.770467 IP BUILDBOX8.1947 > ddkf5yf2.pgo.local.3991: S 3101441507:3101441507(0) ack 4007421108 win 8192 <mss 1460,nop,wscale 8,nop,nop,sackOK>
03:12:07.770965 IP ddkf5yf2.pgo.local.3991 > BUILDBOX8.1947: . ack 1 win 256
03:12:07.771177 IP ddkf5yf2.pgo.local.3991 > BUILDBOX8.1947: P 1:276(275) ack 1 win 256
03:12:07.771840 IP BUILDBOX8.1947 > ddkf5yf2.pgo.local.3991: P 1:222(221) ack 276 win 256
03:12:07.771897 IP BUILDBOX8.1947 > ddkf5yf2.pgo.local.3991: F 222:222(0) ack 276 win 256
03:12:07.772429 IP ddkf5yf2.pgo.local.3991 > BUILDBOX8.1947: . ack 223 win 255
03:12:07.772432 IP ddkf5yf2.pgo.local.3991 > BUILDBOX8.1947: F 276:276(0) ack 223 win 255
03:12:07.772454 IP BUILDBOX8.1947 > ddkf5yf2.pgo.local.3991: . ack 277 win 256
03:12:07.786858 arp who-has 192.168.20.15 tell vCenter
03:12:07.791379 802.1d unknown version
03:12:07.902006 arp who-has d3xb2lg2.pgo.local tell vCenter
03:12:07.939178 IP ddmynb1s1.pgo.local.1038 > 192.168.20.255.1947: UDP, length 40
03:12:07.939337 IP BUILDBOX8.1947 > ddmynb1s1.pgo.local.1038: UDP, length 40
03:12:08.004560 IP server2k3-vdc.pgo.local.137 > 192.168.20.255.137: UDP, length 50
